{
  "schema_version": "1.0",
  "event_id": "f3a6c1e2-2b39-4a34-9b7a-6c1d9a5e2f10",
  "timestamp": "2026-09-16T09:12:03Z",
  "camera_id": "main-entrance-1",
  "solution_pack": "surveillance",
  "application": "face_recognition",
  "event_type": "face_detection_event",
  "payload": {
    "subject": {
      "bbox": [
        512.0,
        140.0,
        601.0,
        244.0
      ]
    },
    "embeddings": {
      "face": [
        -0.07138295277698993,
        -0.013486180563383632,
        0.023421407524330255,
        0.022545517448845292,
        -0.08040992481671022,
        -0.047916222766987454,
        -0.004940665890894454,
        -0.0329054888510925,
        0.01913246139816159,
        0.009455234333540416,
        -0.04549805792411172,
        -0.01263358647111604,
        0.06258555558074488,
        0.03890680260198297,
        -0.007038383941258708,
        0.016056693066543833,
        0.031100537480251142,
        0.017666630961479902,
        0.0004299465767610379,
        0.056218517384856566,
        0.04442254063408692,
        -0.02850796177916682,
        0.004703014905802435,
        0.0005401998671246191,
        0.017694543256944136,
        0.007175863369870559,
        0.0035663073753675113,
        -0.03518457957384733,
        0.03975819346457715,
        0.01057919980688408,
        0.019817337071172794,
        -0.031157976690606343,
        -0.005194610242750514,
        -0.040335387873771764,
        0.022903271111404538,
        0.005590562399108604,
        -0.045643223669168446,
        0.02326383164394194,
        0.01722604810906242,
        -0.016861550849037652,
        -0.0037476722982563958,
        0.04738532711049045,
        -0.06028652787971669,
        0.04296327719654855,
        0.02351210722749646,
        -0.03106879244631241,
        -0.006100377226572228,
        -0.0013076223830990317,
        -0.0017682397225562095,
        0.14496405029876097,
        0.03621420704357748,
        0.06554954963614572,
        0.008636718764741655,
        -0.013386810412974659,
        0.014660328761240633,
        -0.014654592588553991,
        -0.06918382380769697,
        0.0027458778216366063,
        -0.015913879252191742,
        0.010307129283562444,
        0.0058925795496972445,
        0.0008510673390225768,
        -0.0020984672187460015,
        -0.03156067375650208,
        0.0739496568751471,
        0.025809743555237987,
        0.058526006566305605,
        0.05879111922739626,
        0.017747010071151523,
        0.03252486019323663,
        0.001081273292238695,
        -0.039201164958965466,
        -0.029572191488384927,
        -0.06294047141257289,
        -0.07805208724163429,
        0.028627763721423803,
        -0.0009616722439980726,
        0.07556668351477681,
        0.048494246662724734,
        0.020133035413529433,
        -0.01697385243269567,
        -0.05781564524394969,
        -0.05858434367060504,
        0.032471678679674765,
        0.03407225174041494,
        -0.027397751209887845,
        -0.06080700781704964,
        0.002679075520292154,
        0.05204622371662538,
        0.005945851652910974,
        -0.028526872529035036,
        -0.050976371389728416,
        -0.04913314832229724,
        -0.006262433016181655,
        -0.053170264530950355,
        -0.057790927808818074,
        -0.006160284100731037,
        0.012075922739700736,
        -0.005815289614168319,
        -0.001613858000868924,
        0.003172251610622755,
        0.03428809700748581,
        -0.005001874514168422,
        -0.01577708344522599,
        -0.00022602212620705632,
        -0.07496650994084086,
        0.02863050563939525,
        0.060041993806425976,
        -0.0697719451051992,
        0.016066505953313045,
        0.021510164914535976,
        -0.023894406475446512,
        0.013018770553765406,
        -0.054563134679373904,
        0.057954375074816836,
        -0.007579726396679541,
        0.03420032932251352,
        -0.027613694523833894,
        -0.13315852748267254,
        -0.04982741792525491,
        0.03087879081693639,
        -0.020216423043503285,
        -0.014707998257565144,
        0.039995161403223047,
        -0.07492118270922617,
        0.02236618789186749,
        -0.007781118103445314,
        -0.010474199673250018,
        -0.003999138501167022,
        0.03119671292468717,
        0.025399432790097765,
        -0.014557074481698927,
        -0.04955618949658698,
        0.03197153152527393,
        -0.07478167734742482,
        -0.11170975470596078,
        -0.05396672029274447,
        -0.0009788738892401961,
        0.14147580941976848,
        0.00574805711660347,
        0.11683086212905955,
        0.05614784319239155,
        -0.030784358582738737,
        0.028291755104725324,
        0.009776508186094168,
        0.04476362715136203,
        -0.0428136156245137,
        -0.03745739554699179,
        -0.04418970589886977,
        -0.007080032376268265,
        -0.06923158233058944,
        0.0003864563454377361,
        -0.0413691549955627,
        0.026238910153939303,
        -8.771404670528124e-05,
        -0.017402467424806892,
        0.03993303985293421,
        -0.01969614021090092,
        0.026540638091735378,
        0.07965732560924654,
        -0.0033418784025264145,
        -0.02751173855613348,
        -0.0033179038527916824,
        -0.03137680820896176,
        0.031828372173949356,
        0.0069479731551524105,
        0.05324904837668295,
        0.04717084248533038,
        -0.07614250951796725,
        -0.0215323141671263,
        -0.026344629396347095,
        -0.059972361331691225,
        0.009307644108607805,
        0.015137189677610569,
        0.0030564511592998927,
        0.08468391298699819,
        -0.010877769027065753,
        -0.06413570119301011,
        0.01062803088857532,
        0.008947656600886894,
        -0.03384194886344342,
        0.04968336328029229,
        0.05260021916266877,
        0.05287160192007307,
        -0.013901827239153971,
        0.02164467844797274,
        0.013535228823111818,
        0.08540115073779171,
        0.014634661206901814,
        0.03279438799327734,
        0.05277098917457753,
        0.04710765596997099,
        -0.01633685493321776,
        -0.032941799871555655,
        -0.0018256050504770413,
        -0.002863680458065889,
        -0.0685385656096631,
        0.081731107424887,
        0.01297306836389393,
        0.11283183480369788,
        0.015569121682503594,
        0.00863240825314221,
        0.02901128596183177,
        -0.027307140784084433,
        -0.017858788891255632,
        0.026046575676218667,
        0.0203169232223262,
        -0.0030618880177141713,
        -0.06533131242277465,
        0.016994325987842278,
        -0.07174120634806076,
        0.0071126052206740365,
        -0.024017140500956855,
        -0.051033135942347166,
        -0.05952891833247449,
        -0.04625183698278433,
        -0.06805145874449095,
        0.0032650432085906877,
        0.006359643097608417,
        0.02484093547433004,
        0.02592519319511417,
        0.01625937837039293,
        0.005691231348438971,
        -0.04390374216777749,
        -0.024406535150190704,
        0.024959539207726776,
        0.022870420774043318,
        0.03285360211401964,
        0.003802787514914481,
        -0.04146518713922516,
        -0.08774897771330434,
        -0.013037611426636207,
        0.10161971429670232,
        -0.04053430631231366,
        0.05259182049228782,
        0.06268679290830312,
        0.01925798356943429,
        -0.07155644425876771,
        -0.025580060820808673,
        0.08633229066997719,
        -0.01865490577098929,
        -0.022899102403480722,
        -0.08832401653596421,
        -0.0005961495380164927,
        -0.0076107619618227705,
        -0.009483248454101544,
        -0.024524783390011587,
        -0.035823823327919335,
        -0.048680249930550805,
        -0.019465383199481205,
        -0.005821771578064667,
        -0.025416764866480354,
        -0.03058401520378628,
        -0.0062389612590661,
        -0.01839885332321467,
        0.020344683535314306,
        -0.040784135928121336,
        0.04319492453672815,
        0.03576858855635533,
        -0.04994779274352186,
        -0.055738250637303685,
        0.07747501511570219,
        0.046563062795407485,
        0.04556452947915142,
        0.0590289688040734,
        -0.09273683087808501,
        -0.10628340374176826,
        0.016501209813816073,
        0.05773784833920239,
        -0.025880513108257085,
        0.07193856033507177,
        0.034912520046847834,
        0.029680194546049227,
        -0.03869596454943718,
        -0.020409063941446568,
        0.04200869301928463,
        0.0285535202106904,
        0.03809422821306167,
        0.015043636949417653,
        0.03339048866336074,
        -0.024158334768806976,
        -0.04855961569489818,
        -0.042130768117872294,
        0.062174876000476824,
        -0.011498605652714907,
        -0.016029734452822925,
        9.614608395606879e-05,
        -0.0959563660097837,
        -0.012281750631779586,
        0.11337250998574326,
        0.029465194497700756,
        -0.017851258322623187,
        -0.03644094483487308,
        0.02580643048650703,
        0.011440576157393035,
        0.03362066007733538,
        -0.10061175722523749,
        -0.05466909563790641,
        -0.0016052861435042931,
        0.007131885712928479,
        0.017097417846479262,
        -0.02195895698477959,
        0.09034327232577245,
        -0.03504250452545727,
        -0.017794561773163436,
        0.0698575850810421,
        0.009673893909098777,
        -0.047852608944113764,
        -0.015354942518031895,
        0.07724194653046505,
        0.0026305518716027458,
        0.025104768126409025,
        0.03778610094512367,
        -0.002192108629994398,
        2.8176564170549083e-05,
        -0.06459666236703775,
        0.050530236875959464,
        0.03779929000800954,